filerIdent,filerName,payeeNameOrganization,2021,2022,2023,2024,Total
Total,,,1444624.71,101473.64,109023.84,102324.74,1757446.9300000002
00085302,Save Austin Now PAC,WAB Holdings LLC,1442318.2,73490.23999999999,109023.84,,1624832.28
00084624,Make Liberty Win,WAB Holdings LLC,,,,96729.4,96729.4
00081129,Fight for Tomorrow,"WAB Holdings, LLC",,20000.0,,,20000.0
00039023,Travis County Republican Party (CEC),WAB Holdings LLC,1818.0,7683.4,,,9501.4
00085302,Save Austin Now PAC,WAB HOLDINGS LLC  SA,,,,5595.34,5595.34
00039023,Travis County Republican Party (CEC),WAB Strategic,488.51,,,,488.51
00082192,"Mackowiak, Matthew L. (Mr.)",WAB Holdings,,300.0,,,300.0
